<resources xmlns:xsi="http://www.w3.org/2001/XMLSchema-instance"
 xsi:noNamespaceSchemaLocation="../schema/lass_import_format.xsd">
    <!-- In this one, the data values match some field of the timestamp in UTC.
    Tests date, string, and integer parsing. -->
    <columns timeFormat="STK">
         <column id="MMMM" description="month" type="String" interpolation="instantaneous"/>
         <column id="d" description="day" type="Integer" interpolation="instantaneous"/>
         <column id="yyyy" description="year" type="Integer" interpolation="instantaneous"/>
         <column id="H" description="hour" type="Integer" interpolation="instantaneous"/>
         <column id="m" description="minute" type="Integer" interpolation="instantaneous"/>
         <column id="s" description="second" type="Integer" interpolation="instantaneous"/>
         <column id="SSS" description="millisecond" type="Integer" interpolation="instantaneous"/>
    </columns>
    <data>
        <![CDATA[
               StartTime,MMMM, d, yyyy, H,m,s,SSS
    9 Apr 2011 00:00:10.000,April,9, 2011, 0,0,10, 0
    15 Apr 2011 12:34:56.789,April,15, 2011,   12,34,56, 789
    1 May 2011 13:00:00.001, May,1, 2011,   13,00,00, 1
    ]]>
    </data>
</resources>
